key	text	tooltip
building_description_texts_long_description_vik_salt_long	Salt was vitally important for its use in the preservation of fish and meat throughout the medieval period, when it was mostly obtained from salt pans in coastal areas and royally designated ‘salt districts’. Early records highlight the significance of saltworks to Anglo-Saxon kings, with the 11th century Domesday book listing up to 285 salt pans in Sussex alone. Royal charters from before that time already mention salt production as an important function for some royal estates, where kings of the era were known to have made provisions for the appropriate facilities wherever the resource was available. The Vikings, known to have been quite fond of meat, were undoubtedly also familiar with food preservation techniques, but may have used curdled milk as a preservative rather than salt. With Britain’s extensive history in salt production, however, they likely switched to salt-curing processes to take advantage of the more effective local resource of their newly-settled land.	true
building_description_texts_long_description_vik_mint_long	The increase in power centralisation in early medieval England inevitably meant that rulers gained a wider reach to administer and intervene in the daily life of the ruled. This was exemplified not only in the creation of towns during the period, but also the production and use of coinage. Legitimised, emblazoned wealth with clearly definable value was useful for many reasons, enabling kings to draw income from several sources from across his lands – things like tributes, tolls, fines, and forfeitures incurred in the law courts, with paid coinage typically presided over by royal reeves. By the end of the 9th century, there were a few mints located in the most secure royal centres in Britain. The most astute rulers divided their royal income into fractions earmarked for special purposes, an undertaking which would have been impossible without coinage systems run by educated men.	true
building_description_texts_long_description_vik_master_forge_long	As the economy of Anglo-Saxon England experienced changes and advancements between the late 7th and mid-9th centuries, the Mercian kings demonstrated a notable ability to harness the various sources of wealth in the land to increase their own power. Such wealth is perhaps no more evident anywhere else as in the findings observed in the Staffordshire Hoard, the largest collection of Anglo-Saxon gold and silver metalwork ever found. The artefacts date back to the seventh or eighth century, with their location placing them right in the period of the Kingdom of Mercia. Although metalworking had a pragmatic place in Anglo-Saxon society, the findings in the hoard are almost exclusively martial in character, with a notably high level of workmanship. For the Mercians, weaponry was clearly used symbolically as well as practically – an indication of status both on and off the battlefield. As such, Mercian weapons would have partly been the product of the blacksmith, and partly that of the goldsmith or jeweller.	true
building_description_texts_long_description_vik_round_tower_long	During the Dark Ages, many tall, round-tower structures were constructed in northern parts of the British Isles and Ireland. Known as ‘brochs’ in Scotland, and ‘cloigtheach’ in Ireland, the reasons for their construction are not always clear, but their names give clues as to their purpose. ‘Broch’ has its roots in the word ‘brough’, a lowland word for fort and similar in meaning to the Germanic ‘burg’ and ‘borough’, while ‘Cloigtheach’ means ‘bell house’. This, along with the clusters of village buildings at their feet, indicates that these towers were intended for both defensive and public order purposes. With some towers being up to forty metres high, they enabled a 360-degree view of the surrounding land and therefore any approaching forces, with entrance doors that were usually several feet up and accessible with a ladder which could be raised or lowered, or postholes into which wooden steps could be inserted for the same purpose. Rooms within the towers were generally positioned inside a second wall, with stairs between the two to give access to the upper levels. This made them very secure and therefore a likely place to keep valuables safe from marauding raiders.	true
building_description_texts_long_description_vik_nunnaminster_long	Although the war with the Vikings had taken much out of King Alfred and his West Saxon kingdom, the venerable monarch was tireless in his efforts to set about restoring society by promoting learning, order, and peace within his kingdom. Part of those efforts was his reinstitution of the church’s influence and importance, and he did so by setting up two new religious houses in Winchester – a new monastery for monks known as New Minster, and an abbey for nuns known as the nun’s minster or ‘Nunnaminster’. Ran under Benedictine rule, it was closely connected to the royal household and was one of the foremost centres of learning and art in southern England of the Dark Ages. In its original form, the nunnery was a double-domed wooden structure that was eventually rebuilt in stone like other religious buildings of its type in the era. It sat in isolation from the growing city of Winchester within a single enclosure that covered an extensive area, also containing the newly-built New Minster, as well as the older Anglo-Saxon cathedral known as Old Minster.	true
building_description_texts_long_description_vik_scoan_abbey_long	Old Scone was one of the noteworthy ancient capitals of the Pictish kingdoms, the rulers of which presided over the constantly shifting dominions of the north. With the spread of Christianity in the Dark Ages, Scone became a notable location for the early Christian church in Scotland. It was there that an Augustinian monastery known as Scone Priory was founded, which eventually became an Abbot’s residence, and later on encompassed the grounds of the chief residence of Scottish kings, Scone Palace. For many years before it housed royalty, however, the abbey at Scone had been an important venue. It stood opposite an old Moot Hill that acted as a famous coronation site of numerous ancient kings, and at one point was home to the mysterious ‘Stone of Destiny’, a holy relic also known as ‘The Stone of Scone’. A pale rectangular block of sandstone weighing around 152kg, Scottish kings would sit on it during coronation ceremonies as part of an old tradition practiced in Ireland and Scotland since ancient times. The Stone of Destiny was used to enthrone Scottish monarchs at Iona and Dunadd before being used at Scone, and is considered a powerful living symbol of Scottish nationalism.	true
building_description_texts_long_description_vik_court_school_long	By the time of King Alfred the Great’s treaty with Guthrum the Dane in AD 878, the war had already taken much out of Alfred’s West Saxon kingdom. Even so, the venerable monarch was nevertheless tireless in his efforts to set about restoring society by promoting learning, order, and peace within his kingdom. For Alfred, the greatest failing of his peoples was their laziness in pursuing wisdom and promoting education, so to address this perceived problem he gathered court scholars from around Britain and the continent to revive learning in his kingdom. Central to his reforms was the idea that education was not just an obligation for the clergy or monks, as was the case at the time, but for all those who served in his court. Convinced that the exercising of power had to have the precondition of wisdom, he cajoled and threatened his nobles with dismissal if they did not learn how to read – an extraordinary demand in a time when most men had likely been illiterate since childhood. Almost immediately, his ealdormen and thegns did as he requested, such was their unwillingness to otherwise relinquish their offices of power.	true
building_description_texts_long_description_vik_wax_long	Candles are a valuable comodity, bringing light to the halls of those rich enough to burn them. The monks here are trained to raise bees to fufill that demand and support the monastery. 	true
building_description_texts_long_description_PLACEHOLDER	[PLACEHOLDER] Long Description	true
building_description_texts_long_description_vik_port_fish_long	The effectiveness of early ship development of the various groups vying for power in Viking-era Britain arguably shaped its destiny. Even before King Alfred’s foundation of what is considered the first large-scale royal navy in the 9th century, the inhabitants of the Isles would have long been able seafarers for the purposes of commerce, fishing, and faster travel. As with other areas of innovation, ship designs often took on external influences out of necessity, but that was not the case for everyone. For example, the Saxons were originally settlers from across the sea themselves so had their own techniques, while the Vikings were defined by their superior abilities in shipbuilding from their need to cross vast oceans, sail up rivers, and carry out swift coastal raids. In all cases, however, facilities would always be needed to safely load and unload ships, whether the cargo was tradeable goods, warriors, or just normal travelling folk.	true
building_description_texts_long_description_vik_great_hall_long	By the post-Roman era, most communities on the British Isles had moved away from the tribal hierarchies seen in past centuries and started to be ruled over by fully-fledged kingdoms. Tribal hall buildings remained important meeting places, however, acting as effective arms of governance and dispensation of justice. They were also the assembly places for groups like guilds, religious orders, and ‘tithings’, that is, groups of kinsmen or unrelated freemen who acted as sureties for one another's behaviour. Saxon and Viking poetry often alludes to the ‘joys of the hall’, a clear reference to the feasting and drinking that often took place before or after battles. This also served a quasi-political purpose, as successful kings did not only attract men to their service solely by being courageous warriors or effective rulers – the faithful would share in their leaders’ revelries in return for being eternally prepared to fight and die for them in times of war.	true
building_description_texts_long_description_vik_hof_long	"Thorgrim Helgason had a large temple built in his hayfield…. Everybody had to pay a temple fee. Thor was the god most honoured there. It was rounded on the inside, like a vault, and there were windows and wall-hangings everywhere. The image of Thor stood in the center, with other gods on both sides. In front of them was an altar made with great skill and covered with iron on the top. On this there was to be a fire which would never go out—they called it sacred fire. On the altar was to lie a great armband, made of silver. The temple godi was to wear it on his arm at all gatherings, and everyone was to swear oaths on it whenever a suit was brought. A great copper bowl was to stand on the altar, and into it was to go all the blood which came from animals or men given to Thor. They called this sacrificial blood [hlaut] and the sacrificial blood bowl [hlautbolli]. This blood was to be sprinkled over men and animals, and the animals that were given in sacrifice were to be used for feasting when sacrificial banquets were held. Men whom they sacrificed were to be cast into a pool which was outside by the door; they called it Blótkelda (Well of Sacrifice).	true
building_description_texts_long_description_vik_archery_long	Wob's my name if you work it out;\\nI'm a fair creature fashioned for battle\\nWhen I bend and shoot my deadly shaft\\nfrom my stomach, I desire only to send\\nthat poison as far away as possible.\\nWhen my lord, who devised this torment for me,\\nreleases my limbs, I become longer\\nand, bent upon slaughter, spit out\\nthat deadly poison I swallowed before.\\nNo man's parted easily from the object\\nI describe; if he's struck by what flies\\nfrom my stomach, he pays for its poison\\nwith his strength - speedy atonement for his life\\nI'll serve no master when unstrung, only when\\nI'm cunningly nocked. Now guess my name.\\n	true
building_description_texts_long_description_vik_athletics_long	9th and 10th century Irish armies were often supported by non-warriors and youths who, being without normal weaponry, would support their fellow tribe member by pelting the enemy battle line with rocks, light javelins, and whatever else would come to hand. These chaps would be next to useless in a stand up fight but are ideal for causing a steady drip of casualties before the main units charge in. It would be a dreadful mistake, however, to discount the intense killing power a barrage of stones and missiles can inflict on the enemy. Many wars have been won simply by utilising ‘harass and retreat’ tactics over an extended period of time to deny the enemy their objective.	true
building_description_texts_long_description_vik_oxford_long	As the oldest university in the English-speaking world, Oxford is a unique and historic institution. It was agreed for many centuries that King Alfred was personally responsible for founding the school in 872 AD after a scholarly debate with monks that lasted several days, though there is no real reason to believe this myth. Coins have been found from the reign of King Alfred which bear the mark "Ohsnafordia", which may indicate the presence of a royal mint at Oxford. In reality, it grew up in the 12th century when famous teachers began to lecture there and groups of students came to live and study in Oxford. The university was given a boost in 1167 when, for political reasons, Henry II banned English students from attending the University of Paris and forced many of them to come home. 	true
building_description_texts_long_description_vik_island_monastery_long	In the 7th century, King Oswald, arguably the most powerful Anglo-Saxon warlord in Britain in his day, gifted the Island of Lindisfarne to the monks from Iona, thereby enabling them to establish a monastery and a bishopric in the political heart of the Northumbrian kingdom. Miracles were reported at St Cuthbert’s shrine, the monastery's most venerated Saint, and Lindisfarne was quickly established as a major pilgrimage and centre of Christian learning in Northumbria. As a result, the monastery grew in power and wealth, attracting grants of land from kings and nobles as well as gifts of money and precious objects. On 793 AD Lindisfarne suffered a devastating raid by Viking pirates – their first significant attack in Western Europe. The raid was physically and psychologically devastating to all Christians, even on the Continent - one of England’s holiest shrines had been attacked by pagans, and St Cuthbert had not intervened to stop them.	true
building_description_texts_long_description_vik_foreigners_3	A typical Scandinavian house measured 5 by 12 meters (16 by 40 feet). The central room was the main living quarters, for cooking, living, and sleeping, having the typical central fire pit and raised benches along the walls. An adjoining room contained a domed cook oven and storage space. Food for the town was imported from nearby farms. Another room served as a workshop, with a window in the gable for light.	true
building_description_texts_long_description_vik_foreigners_2	A typical Scandinavian house measured 5 by 12 meters (16 by 40 feet). The central room was the main living quarters, for cooking, living, and sleeping, having the typical central fire pit and raised benches along the walls. An adjoining room contained a domed cook oven and storage space. Food for the town was imported from nearby farms. Another room served as a workshop, with a window in the gable for light.	true
building_description_texts_long_description_vik_foreigners_1	A typical Scandinavian house measured 5 by 12 meters (16 by 40 feet). The central room was the main living quarters, for cooking, living, and sleeping, having the typical central fire pit and raised benches along the walls. An adjoining room contained a domed cook oven and storage space. Food for the town was imported from nearby farms. Another room served as a workshop, with a window in the gable for light.	true
building_description_texts_long_description_vik_borough_5	The Five Boroughs of Danelaw were the five most important towns existing under Danish law and customs, located in the territory of Danish Mercia. The boroughs were referred to as such because of their fortifications, as ‘borough’ derives from the Old English world ‘burh’ (or ‘burg’), roughly translating from the German “burg” meaning castle. Therefore as part of the town’s structure, fortifications and surrounding walls enclosed the residents, protecting them from attacks. Over time, these areas would become a distinguished part of the country where its leaders held great sway. Each borough was ruled as a Danish Jarldom while answering to overlords in Jorvik.	true
building_description_texts_long_description_vik_borough_4	The Five Boroughs of Danelaw were the five most important towns existing under Danish law and customs, located in the territory of Danish Mercia. The boroughs were referred to as such because of their fortifications, as ‘borough’ derives from the Old English world ‘burh’ (or ‘burg’), roughly translating from the German “burg” meaning castle. Therefore as part of the town’s structure, fortifications and surrounding walls enclosed the residents, protecting them from attacks. Over time, these areas would become a distinguished part of the country where its leaders held great sway. Each borough was ruled as a Danish Jarldom while answering to overlords in Jorvik.	true
building_description_texts_long_description_vik_borough_1	The Five Boroughs of Danelaw were the five most important towns existing under Danish law and customs, located in the territory of Danish Mercia. The boroughs were referred to as such because of their fortifications, as ‘borough’ derives from the Old English world ‘burh’ (or ‘burg’), roughly translating from the German “burg” meaning castle. Therefore as part of the town’s structure, fortifications and surrounding walls enclosed the residents, protecting them from attacks. Over time, these areas would become a distinguished part of the country where its leaders held great sway. Each borough was ruled as a Danish Jarldom while answering to overlords in Jorvik.	true
building_description_texts_long_description_vik_borough_3	The Five Boroughs of Danelaw were the five most important towns existing under Danish law and customs, located in the territory of Danish Mercia. The boroughs were referred to as such because of their fortifications, as ‘borough’ derives from the Old English world ‘burh’ (or ‘burg’), roughly translating from the German “burg” meaning castle. Therefore as part of the town’s structure, fortifications and surrounding walls enclosed the residents, protecting them from attacks. Over time, these areas would become a distinguished part of the country where its leaders held great sway. Each borough was ruled as a Danish Jarldom while answering to overlords in Jorvik.	true
building_description_texts_long_description_vik_borough_2	The Five Boroughs of Danelaw were the five most important towns existing under Danish law and customs, located in the territory of Danish Mercia. The boroughs were referred to as such because of their fortifications, as ‘borough’ derives from the Old English world ‘burh’ (or ‘burg’), roughly translating from the German “burg” meaning castle. Therefore as part of the town’s structure, fortifications and surrounding walls enclosed the residents, protecting them from attacks. Over time, these areas would become a distinguished part of the country where its leaders held great sway. Each borough was ruled as a Danish Jarldom while answering to overlords in Jorvik.	true
