key	text	tooltip
building_description_texts_long_description_vik_konungsgurtha_long	Following the Vikings’ prolonged campaigns against the Saxons, part of the invading Great Army returned to Northumbria in AD 876 and the newly-conquered lands were shared out amongst them. York had already seen several battles and sieges by that time, with many parts of the city damaged from the struggles. Buildings such as the old Roman defences and towers had deteriorated into a poor condition, and those which were damaged but hadn't yet fallen were demolished by the new settlers. In addition to cultivating the surrounding land with the intention to stay permanently, history also relates how the Vikings rebuilt parts of the city. The southwest gate of the original fortress had survived, so was used to form part of a new royal palace of the Viking kings, a building that became known as the ‘Konungsgurtha’, or the ‘King’s Court’ in Old Norse. It acted as the seat of the subsequent Viking rulers of Northumbria in the following years and nucleated the city, with new streets and timber houses added to the surrounding area over time.	true
building_description_texts_long_description_vik_grianan_ailech_long	One of the most magnificent remnants of the Irish-Gaelic kingdoms of old is the 1500 year-old circular hillfort known as Grianan of Aileach. Still standing on Greenan Mountain today, the monument was once a bastion of the Kingdom of Aileach, which flourished between the 5th and 12th centuries. However, the location’s importance stretches back several thousands of years before that. A prehistoric burial mound is evidence of human activity as far back as Neolithic times. The great stone ringfort there today has been restored from the one built by the ruling Ui Neill dynasty in the 6th century, but an older hillfort was one of just five Irish sites on Ptolemy of Alexandria’s 2nd century map of the world, indicating that the site was in similar use far earlier.	true
building_description_texts_long_description_vik_thing_long	Wherever the Vikings arrived to settle, they brought their customs and legal systems with them, as it was during their settlement in Britain. In the latter part of the 9th century, the area in which the laws of the recently settled Danes held sway was known as the Danelaw – a geographical demarcation created after King Alfred of the West Saxons inflicted defeat upon them in AD 878, resulting in a treaty that granted them the lands of the ‘Five Boroughs’ in which to expound their own laws. It was in these regions that the freemen of Viking society would gather into ‘Things’ to settle their disputes out in the open. Things were groups of individuals assembled to make collective decisions, a practice considered to be the cradle of Scandinavian democracy. They would make important political decisions, while overseeing that laws were being upheld, and the ‘Thingsteads’ where they would gather were often the focal points for trade and religious activity. In Viking-age Britain, the use of Things was not confined to the Danelaw, but everywhere the Vikings settled, including Shetland, Orkney, the highlands of Scotland, and Man.	true
building_description_texts_long_description_vik_fogou_long	Some of the oldest and most interesting examples of human habitation in ancient Cornwall are several ancient, man-made caves and passageways known as ‘fogous’, named for the Cornish word ‘fogo’, meaning ‘cave’. Although similar to souterrains and earth-houses found in Scotland and Ireland, the Cornish examples differ in that they were often found in more settled areas protected by earthwork defences and inhabited by several families. Fogous continued to be important into the Viking era and their proximity to settlements indicates they were probably places of refuge and storage, with constricting ‘creep’ entrances providing some level of hindrance to attackers. Another curious feature hints at ritualistic use, as their passageways were almost always orientated towards the rising and setting midsummer sun.	true
building_description_texts_long_description_vik_st_dewi_long	Sometime in the early 6th century, as a wild thunderstorm battered the cliffs of modern-day Pembrokeshire in southwest Wales, Saint David was born. A man of considerable importance to the Celtic Church in his later life, he was originally named ‘Dewidd’, locally pronounced as ‘Dewi’. Accounts compiled many centuries after his lifetime allude to him being the son of a Welsh prince, with some legends claiming that his birth was foretold to Saint Patrick by an angel thirty years before it occurred. David was a puritan who practiced strict self-imposed penance, only consuming bread, vegetables, and water, and his most well-known miracle was the conjuring up of a hill beneath his own feet as he delivered a sermon to a large crowd, elevating himself so he could be seen and heard by all. David’s assignation as the patron saint of Wales is certainly attributed to many such legends and miracles, as well as tangible facts. Historically, he is thought to have founded many monasteries, including one in Menevia, near to his birthplace. The settlement which grew around it became known as ‘Tyddewi’, or ‘David’s House’, which later encompassed a site of great pilgrimage when it housed the great saint’s relics within the Cathedral of St David.	true
building_description_texts_long_description_vik_cloth_long	Much of Britain is ideal for raising sheep, though the growing importance of cavalry for economic and military reasons led many kings to devote more effort towards the rearing of horses. 	true
building_description_texts_long_description_vik_tools_long	Without the invention, innovation, and manufacture of tools, civilisation would not experience progress. Tools facilitate the necessities of survival, and where one tool is unsuitable, efforts are generally made to invent new ones. In many cases, such processes are organic and come about naturally by osmosis from other cultures. For example, there is no firm evidence for the use of an ox or horse-drawn plough by the Anglo-Saxons prior to the 10th century, but it is thought that before that time, land cultivation was carried out with the use of wooden harrows, such as the one depicted on the Bayeux Tapestry. Unsurprisingly, tool development has always been intrinsically linked to advancements in materials and metallurgy. With the Iron Age already well underway in Europe by the time the Romans withdrew from Britain, the use of iron tools was already fairly widespread by the time the Vikings arrived.	true
building_description_texts_long_description_vik_thrall_long	The post-Roman era slave trade was reasonably active on the British Isles by the time of the Viking raids - a remnant of the socio-political systems left behind by the Romans themselves. Although the Romans never annexed Ireland specifically into their empire, they still had a commercial relationship with the island, creating a slave trade which even caused a depopulation there at the time. When the Viking kings settled, they brought with them their three-tiered stratification of society – noblemen, freemen, and thralls – which served to give the slave trade an even greater importance locally. Irish kings of the 10th century were also known to take swathes of slaves as booties of war, undoubtedly to profit from the burgeoning local slave markets of Ireland’s major ports at the time, which had been spearheaded by Viking settlement.	true
building_description_texts_long_description_vik_arena_long	Fighting as entertainment has deep roots which stretch back to antiquity. Homer mentions boxing in his epic 'the Iliad' in the eighth century BC, and an early version of mixed martial arts combining fist-fighting and wrestling known as 'pankration' was a common sight at the early Olympic Games. More broadly, fist-fighting was a common way of settling disputes throughout history, especially in societies in which warfare was part of life such as Viking-era Britain. The works of the historian Bede mention wild, physical, and competitive games that were encouraged to develop the warrior elite of English society, and one might assume that one-on-one combat was amongst such activities. Although it may have ended in injury or death for one of the participants, fighting as a spectacle would have been considered much more valuable and honourable for the participant – and arguably more entertaining for the spectator – than other pastimes of the era such as bear-baiting and cock-fighting.	true
building_description_texts_long_description_vik_church_crafts_long	Although a love of jewellery and crafts was already ingrained with British and Anglo-Saxon culture by the time of their conversion to Christianity, the Church nevertheless became a driving force for many of the crafts produced from that point onwards. Aside from metal and glass work, advanced textiles and tapestry-work became part of a signature style and votive pieces. In fact, on the continent ‘Opus Anglicanum’ (literally ‘English Work’) was considered to be among the finest of its kind produced at the time, and was used to decorate European churches from the 8th century until the Norman conquest of 1066.	true
building_description_texts_long_description_vik_forge_long	The honest work of the blacksmith enabled land to be cultivated, ships to be built, stone to be quarried, and wars to be fought with more terrible savagery than ever before. During the Anglo-Saxon era, forges were commonly ephemeral in nature, often roofless to allow as much light in as possible to judge the state of work and surrounded by wattle wind-breaks rather than solid walls – nothing too costly to lose if loose sparks caused a fire. There was usually not much more than a hearth containing a heat source in addition to an anvil upon which the actual hammering took place, sometimes in the form of solid block of cast iron, especially in instances of large-scale production. Tongs, hammers, and bellows have also all been found in areas identified as forge sites of the early Middle Ages, all of which would have been absolutely essential to make a smithy’s painstaking job much easier.	true
building_description_texts_long_description_vik_church_long	By the time the Vikings had settled down in Britain, Christianity had already gained a considerable foothold there. Having been brought to the Isles centuries earlier as one of many Roman cults, Christianity did not only outlive the Roman occupation, but survived in the face of the numerous forms of paganism brought by successive invaders such as the Angles, Saxons, Jutes, and others. In the post-Roman period, the decaying stone remains left by the occupiers inspired settlers with superstitious awe, and provided Christian moralists with a fruitful theme to disseminate their beliefs amongst the population. Spurred on by the missions of Saint Augustine of Canterbury to convert the settled Germanic tribes, several churches were embedded within old Roman edifices throughout England, while in Wales, Scotland, and Ireland, small monastic communities had already become the focal points of most villages. Such locations provided the nuclei for towns and cities which still exist to this day.	true
building_description_texts_long_description_vik_port_trade_long	References to the first merchant ships in Britain date back to before the Viking invasions, with the occupying Romans of earlier centuries also being a large part of the maritime trade that was occurring in late antiquity. The works of the 5th century historian Orosius mention the Saxon word ‘ceapscip’, a direct translation of ‘trading ship’, the examples of which by that time had developed features that were distinctly non-military in function. For example, many had a broad high-sided hull to maximise cargo space, or a reliance on a sail as a primary means of propulsion, since sailing ships had less oarsmen aboard to facilitate more space for cargo. The Viking raids in Britain also resulted in several market ports prospering out of Alfred’s systematic 'burh' fortifications. Trading ports like Hastings and Southampton especially benefited, thriving from the presence of a local populace who sought the protection of the royally decreed forts in coastal areas.	true
building_description_texts_long_description_vik_st_columbe_long	The cathedral which stands in Dunkeld, Scotland today is dedicated to Saint Columbe, one of the famed ‘Twelve Apostles of Ireland’ responsible for the spreading of early Christianity in the region. Its location has long been considered holy ground to Scottish Christianity, ever since Celtic missionaries built the first monastery there in the eighth century within the settlement previously known as ‘Dun Cailden’. It eventually became a major religious centre and place of pilgrimage, especially after Saint Columbe’s relics were moved there from the island of Iona in the face of increasing Viking raids in around AD 850. Columbe himself was, in fact, a descendant of Irish kings, but had become a luminary amongst the Scottish saints after his mission to convert the Gaels and Picts of Scotland in the 6th century. The monastery he set up in Iona became a place of great religious renown and spiritual authority, where several kings, both Gaelic and Viking, sought to be buried due to it being the resting place of Columbe himself, until his relics were moved to Dun Cailden in the 9th century.	true
building_description_texts_long_description_vik_st_cuthbert_long	There are conflicting accounts about the early life of Saint Cuthbert, whose later gift for miraculous healing in an era of frequent sickness had earned him the label ‘Wonder-worker of England’. Flourishing during the 7th century, some historical sources claim he was the son of an Irish king, while others say he was born into poverty in Scotland and fought as young warrior in service to the Kingdom of Northumbria. In any case, Cuthbert became one of the most important figures of the Saxon church in his later life, taking up the priorship of Lindisfarne from AD 664 after Northumbria’s controversial decision to follow Rome’s Christianity in lieu of the already well-established Celtic tradition. Although renowned for being an outgoing, cheerful, and compassionate missionary, he spent his final years as a hermit, and by the time of his death had become so revered that his final resting place at Lindisfarne became a location of mass pilgrimage. Centuries later, the Viking invasions prompted the Lindisfarne monks to evacuate Saint Cuthbert’s remains from the island, and after seven years the relics eventually found their way to nearby Dunholm – modern-day Durham – where a church was built to house them, ironically benefacted by a converted Danish king.	true
building_description_texts_long_description_vik_school_ros_long	In its beginnings as an early Christian settlement, the ancient Irish town of Rosscarbery in modern-day County Cork may have seemed comparatively unimportant, but it eventually became one of the most celebrated locations of religious learning in the Dark Ages. The Irish monk and eventual saint known as Fachtna came to the area towards the end of the 6th century and founded a monastery there, later the principal monastery in southwest Cork and the centre from which the Diocese of Ross developed. Most notably, Fachtna’s establishment came to include the famous scripture school known as the School of Ross, renowned at the time as one of the great seats of Christian education and sanctity. Such was the number of students and monks travelling to it from far and wide to study under the most eminent ecclesiastical professors, that the early form of the settlement’s name, ‘Ros’, meaning ‘wooded headland’ in Old Irish, became ‘Ros-Ailithir’, translating to ‘wooded headland of the pilgrims’. The settlement’s location on seaward slopes at the edge of sheltered cliffs was likely a deliberately defensible position, where the monks could watch for invaders, although the Vikings would not show up for at least another 150 years.	true
building_description_texts_long_description_vik_high_cross_long	In the centuries following the missions of the monk Saint Fursey to convert the British Isles to Christianity, his homeland of Ireland saw the appearance of an art form considered to be their biggest contribution to western European art of the Middle Ages – the Celtic high cross. These free-standing structures mimicked the smaller crosses made out wood and metal common in the period with larger stone versions commonly placed in the grounds of monasteries and cemeteries, as well as sometimes being the focal point for town markets. They were generally used as meeting points for religious ceremonies, but were also placed at crossroads and used to mark out land boundaries. In Ireland, the earliest and most famous examples date back to the 8th or 9th century, and are situated within a few miles of each other in the southwest of the island. The Killamery High Cross located in County Kilkenny is one such example – not only because it is very richly sculptured in images and iconography which are decipherable even today – but also because it was built in a monastery established by a direct disciple of Saint Fursey himself, Saint Goban.	true
building_description_texts_long_description_vik_warehouse_long	As Britannia’s late-Dark Ages arts and crafts culture advanced, systems of trade developed naturally in tandem with it. Merchants operated by purchasing more goods than they needed and then selling on the surplus for a profit, then – if they were shrewd – investing some of that profit back into their businesses. The nature of the free market means demand frequently outstrips supply and vice-versa. This means the serious merchant had to have somewhere to store goods safely, both from the elements and those who would take it from them – thus, warehouses as we know them were born. Generally, these storage spaces would be next the rivers or ports in order to transport the goods around inland or abroad as needed.	true
building_description_texts_long_description_vik_embroiders_long	Spinning and weaving was a craft that earned Canterbury industrial prosperity at various points in its past, and history tells us that an older tradition of embroidery actually existed there as far back as the Dark Ages. A building that still stands in the city today known as ‘The Old Weavers’ House’ was where the Canterbury weavers of the sixteenth century gained their fame, but part of the structure is believed to date back to around the Anglo-Saxon era when the town was known as 'Cantwaraburg', and was a likely location for the production of Opus Anglicanum, or ‘English Work’. This medieval custom of decadent embroidery made use of gold thread, carried out by highly-skilled professionals who would take up to seven years to perfect their craft. The resulting work was unequalled in craftsmanship anywhere else in Europe at the time, resulting in much sought-after fabrics commonly donned as ceremonial clothing by royalty or the clergy, but also used for decorative purposes like the famous example of the Bayeux Embroidery. Another existing specimen is the gold and silk embroidery which drapes the reliquary coffin containing the relics of Saint Cuthbert in Durham Cathedral, identified as being West Saxon Opus Anglicanum work of the tenth century.	true
building_description_texts_long_description_vik_st_ciaran_long	Saint Ciaran was one of the esteemed ‘Twelve Apostles of Ireland’, famously founding a great monastery at Cluain Mac Nois in County Offaly in the 6th century. It became the most influential religious facility of its time, notable for being where the 'Rule of St Ciaran' was developed, the set of ascetic tenets followed by most monastic institutions of the era. The monastery’s geographical location – right in the centre of Ireland positioned next to a river – was due to a premonition had by Ciaran and the famous monk Enda while he was studying under him on the island of Inishmore off the western coast of the mainland. Both men had the same vision of a fruit-laden tree growing on the banks of a stream in the middle of Ireland, with branches spreading out over the entirety of the land. They also saw birds carrying the tree’s fruits off to Britain and elsewhere, all of which Enda interpreted as his student's calling to travel to the centre of Ireland to found a church to spread their beliefs. This was how Ciaran came to establish his famous abbey at Cluain Mac Nois, which became a famous monastic town of the early Middle Ages.	true
building_description_texts_long_description_vik_st_ringan_long	Known to the Northumbrians as ‘Trynnian’ or 'Ninian', Ringan of Whithorn was once considered one of the most important religious figures in Britain. Mentioned fleetingly by the great Northumbrian historian Bede, Saint Ringan was an important part of the Christianisation of the Picts during the 4th and 5th centuries. His greatest achievement, however, was the establishment of his monastery in Galloway. As Pictish Christian centres gradually came under Northumbrian Church control, Ringan’s monastery became a leading monastic centre for northern Anglo-Saxons. There are even several churches and chapels dedicated to him today, particularly in places of Pictish heritage or within old Northumbrian bounds.	true
building_description_texts_long_description_vik_st_brigit_long	Saint Brigit of Nas is one of the best-known Irish saints after Patrick, and like him, much of what is known of her has been encapsulated in the folklore of the region. Her name is analogous with a Celtic goddess associated with many fables and myths of the era in which she lived, which added to her legend. After a childhood spent as a slave, she became known for unceasingly feeding and healing the poor and was famed for her extraordinary purity, piety, and generosity. Such was her reputation that in the late-5th century, the king of Leinster donated a plane of land to her in Nas, modern-day Kildare. On the site stood a large oak tree, under which Saint Brigit built her church known as the ‘Church of the Oak’, or ‘Cill Dara’ in Old Gaelic, after which county Kildare is named. It is widely considered to have been the first nunnery in Ireland, with many other communities of nuns founded by Brigit during her time. Many accounts describe her as a generous woman who performed miracles, and she is even sometimes considered to be a patron saint of beer, allegedly having the ability to turn dirty bathwater into the alcoholic beverage!	true
building_description_texts_long_description_vik_souterrain_long	The use of underground storage is something that the archaeological record shows was common in Ireland and northern Britain, with many examples of souterrains and ‘earth-houses’ distributed throughout Scotland dating back to Roman times. The meaning of souterrain is literally ‘underground’, and such places took the form of passageways, dwellings, and storage facilities hidden just beneath the surface. Their most likely function was food storage, as in Scotland they appear to have been a northern counterpart to the pits and silos of England used for grain surpluses in early medieval times. The evidence for this is a broad correlation between the locations of known souterrains from the period, and the areas known to have good quality arable land at the time. Such cool underground spaces would have also been suitable for milk or meat, while even livestock could have taken refuge in them, although this would have only happened in the largest facilities.	true
building_description_texts_long_description_vik_st_swithun_long	Swithun was one of the most famous bishops of Winchester in the early medieval period, remembered for having great importance to his diocese during and after his 9th century lifetime. An immensely charitable soul who founded many churches, he was also an active counsellor to Saxon kings and even allegedly tutored the young Alfred the Great himself, helping to pave the future king’s way to his later accolades. Swithun had his holy reputation significantly boosted posthumously, after his remains were dug up from their original burial location outside Old Minster and placed within a splendid reliquary inside the building many years later, thus providing a new patron saint and focus of reverence for a newly-formed community of Benedictine monks. Saint Swithun's relics had been associated with several miraculous healing events by that time, but their exhumation and relocation went against his explicit wishes for his grave to be humbly placed outside where ‘the feet of ordinary men could pass over him’ and raindrops could fall upon it. In fact, legend has it that their removal from their original location was accompanied by forty days and forty nights of violent rain storms, a sign of the great saint’s displeasure at being displaced.	true
