key	text	tooltip
#Loc PackedFile;1;text/db/building_description_texts.loc		
building_description_texts_long_description_vik_scribes_long	Before the development of early printing presses in the late medieval period, one of a monk's duties was transcribing and archiving, a physical labour that was part of his daily regime. Those chosen to be scribes were handed an unenviable task – the process of transcribing was back-bending, eye-straining work, with extended periods spent in badly lit, claustrophobic environments. Some monasteries had dedicated writing rooms attached to libraries, known as 'scriptoriums', but not all had such specialised areas. In fact, monks frequently had to find secluded spaces to do their writing wherever they could, such as their own rooms or small areas around the monastery cloister. Much of the scribe's work was religious, writing down passages from the Bible or the Psalms, which would then be recited often as part of daily life, giving the monks a closer understanding of both the text and the tenets of their religion as they worked.	true
building_description_texts_long_description_vik_bullaun_long	A curious feature of monastic sites from Ireland’s era of Christianisation are ‘bowl’ or ‘bullaun’ stones. These artificially hollowed-out basins in rocks, boulders and slabs were used as far back as Neolithic times, but their importance to pre-Christian Irish peoples was sufficient for the early Celtic Church to want to assimilate them. These man-made fossils likely had practical uses for ancient peoples, with archaeological excavations at one site in southeastern Ireland revealing that there may have been an ironworking industry there. The bringing of bowl stones to early Celtic Christian sites strongly implies they also had spiritual or devotional functions pre-Christianity, with records located at pilgrimage sites indicating they were used in rituals. Additionally, Celtic Christian tradition records that those who drank from the stones were healed.	true
building_description_texts_long_description_vik_textiles_long	Weaving is one of the oldest attested crafts in the world and, by antiquity, had permeated every level of society. In its most basic form, slaves and children manufactured cheap, functional cloth, but at the highest level it was practiced by noblewomen who produced rich tapestries and fabrics as a conspicuous display of wealth. In tenth-century Anglo-Saxon England, spinning, weaving, and sewing were almost exclusively female activities, attested to by the presence of a variety of cloth-making equipment in women’s graves dating back to the period. Textile production was always an important factor in most communities of the era, with plenty of evidence showing that Viking-age York was also producing large amounts of wool and flax textiles, although it is not clear whether surpluses were created for export. Findings of silk offcuts and headscarves, however, suggest that at least some textile workers were also handling exported material there.	true
building_description_texts_long_description_vik_craft_merchant_long	Artisanship in the 9th century of England afforded people a certain standard of living in society yet it was still difficult to attain a very high social status. Artisans were classed above peasants and serfs in the feudal system and had a much better level of education. Trades were often kept within families and skills passed down from father to son. Some artisans would make things that were needed in the local economy such as a stonemason who fashioned building materials and tailors who made clothes. Every important medieval town had a blacksmith who made weaponry and a wide range of goods that had practical use in towns and villages. Surnames would often identify the trade of the artisan- names like Miller, Smith, Hunter, or Tanner.	true
building_description_texts_long_description_vik_orchard_long	The historian Tacitus recalled that grape growing was present in Britain as far north as the Midlands prior to the Saxon arrival, despite the overly-moist soil and atmosphere in most parts of the Isles. In fact, many indigenously-grown fruits have ever been consumed all over Britain, with excavations dating back to the early Middle Ages pointing to the consumption of apples, plums, cherries, and sloes in abundance. Vineyards were recorded in the manuscript records of the Domesday book, with various royal estates in present-day Wiltshire, Worcestershire, Hampshire, and Somerset known to have been deliberately built upon orchards to take advantage of the literal fruits of the land. Various fruit-based wines were also being concocted, with evidence in Gloucester dating back to the period pointing to the presence of a large deposit of apple pips, likely to have been the result of large-scale cider production.	true
building_description_texts_long_description_vik_alehouse_long	Thanks to the Romans, the great British pub actually started out two thousand years ago as a great Italian wine bar! Roman taverns, or ‘tabernae’, were originally set up as shops that sold wine, with a deliberate proximity to Roman roads so that many a legionary could be provided with a place to sit and quench his thirst. With ale being Britain’s native brew at the time, taverns quickly adapted to provide locals with whichever tipple they wanted, assuming it was available and the price could be paid. Through times of invasion from Angles, Saxons, Jutes, and others, alehouses and taverns thrived in Britain, eventually evolving into places that also provided food and accommodation for weary travellers such as merchants, court officials, or pilgrims. Being places of congregation in a non-religious sense, taverns also served military purposes, acting as recruitment centres for royal armies, and even for less savoury groups such as mercenaries or bandits.	true
building_description_texts_long_description_vik_hunting_long	The concept of "The Hunt" predates recorded history; earlier human ancestors relied on hunting to survive, making it a cornerstone of the species. Despite the advent of agriculture, hunting remained important as a source of sustenance, recreation, and industry, with hides fetching as high a price as animal meat did. Hunting was carried out all across society in the early medieval British Isles, but for the elite in particular, it was an important physical pursuit. Stag-hunting, fox-hunting, and hawking were favourite pastimes of kings and nobles, and the Vikings settlers would have had a similar propensity for such outdoor activities. Excavations of sites dating back to the Dark Ages reveal sizeable amounts of antler bones, and aside from deer, hunters would have also killed hare and wild boar. Wild birds, including swans, mallards, geese, and pigeons, also provided sources of meat, with large bone deposits suggesting that birds were a significant food source for many.	true
building_description_texts_long_description_vik_pottery_long	Clay has always been abundant in the British Isles, and before the traditional wheel-throwing techniques of pottery shaping were introduced at the end of the Iron Age, they were painstakingly shaped by hand. From the 8th century, however, pottery in Britain began to be mass-produced at industrial centres using better techniques and large purpose-built kilns. The most important centre of pottery manufacture in the era was Ipswich, which at the time transported such products to all corners of Britain. East Anglian pottery finds were commonly associated with high-status sites, indicating how highly they were valued. The presence of the Vikings, especially in urban centres like York, also appears to have affected the quality and quantity of pottery items in some places where more standardised, wheel-thrown and kiln-fired pottery was seen, mass-produced for trade using influences brought in from continental Europe.	true
building_description_texts_long_description_vik_merchant_long	As their society developed in step with sustained periods of relative peace, the Britons, Saxons and Vikings living in the British Isles gradually moved away from basic subsistence bartering to a much more sophisticated trade model. Regular markets, permanently based around local fortresses close to rivers for ease of transport, sprung up all across the country, enabled producers to trade their surplus supplies for things they were unable to produce themselves. This gradually gave rise to a burgeoning class of merchants. Without a reliable, consistently-maintained road system, the riverways were the natural way to transport their goods, as they removed the need for trains of pack-horses and made attacks by brigands far less likely.	true
building_description_texts_long_description_vik_fishing_long	Living in a land of long coastlines and winding rivers, the communities of the British Isles always had fish as a staple food resource. Evidence for the industrial-scale exploitation of fish dates back to the sixth century, but history tells us that some groups were still lagging behind until sometime after that. This was the case for the South Saxons of Sussex, who the historian Bede mentions were on the brink of famine in the seventh century until Bishop Wilfred taught them how to fish while on his conversion mission. Fishing methods changed relatively little throughout the Dark Ages, but were impacted by techniques brought to the Isles by outside settlers such as the Vikings. For example, the large volumes of sea fish being caught by the end of the Anglo-Saxon period were a direct result of the drift net – an imported Viking method which enabled a much greater catch out at sea.	true
building_description_texts_long_description_vik_mountain_hall_long	Din Eidyn, the early medieval name for modern-day Edinburgh, had long been a location of significance to the numerous groups vying for power in the lands of the southern Scottish Lowlands known as the Old North. It was an area mostly inhabited by people of Celtic descent, remaining culturally and linguistically British even after the arrival of foreign groups. One of the rulers whose seat of power was located in Eidyn was Mynyddog Mwynfawr, king of the people who inhabited the Old North during the latter part of the 6th century. His name roughly translates to ‘Wealthy Mountain’, and he was alluded to as a great king who oversaw the resistance struggles of his people against the hostile expansionist kingdoms to the south. According to ancient Brythonic poetry, it was from his halls of power based in Eidyn that he sent a hand-picked elite retinue of three hundred mounted warriors on an ill-fated expedition southward against an Angle-controlled fort in Yorkshire. Although their excursion ended with their defeat and demise, the warriors and their king ‘of the mountain’ were immortalised in prose for their efforts, living on in memory through the eulogies of legendary poets.	true
building_description_texts_long_description_vik_pasture_long	People living on the British Isles during the Anglo-Saxon period relied heavily on cattle, sheep, and pigs to provide the protein that their diets required, with bone evidence showing that pasture farming was widely practiced alongside agriculture and woodland management. Cattle offered a form of mobile wealth, especially in royal circles, as corroborated by the large number of cattle skulls dating back to the 7th century found in the palace enclosure at the historical site of Yeavering. In larger, more urban surroundings of the day such as Viking-occupied York, smaller livestock like pigs and goats were reared within tenement yards, while cattle and sheep were reared in the surrounding countryside and brought on the hoof to market. The meat of the animals wasn’t the only valuable commodity, but also the animal by-products such as wool, skins, leather, and bones for tools. Cattle dung was also highly useful, providing manure to aid agriculture in less fertile soils.	true
building_description_texts_long_description_vik_celi_de_abbey_long	Long before the total conversion of the pagan Saxons, southern Britannia had seen the gradual spread of Christianity from the pockets of followers left by the Romans, accelerated in later centuries with Augustine’s Gregorian mission. In Ireland and parts of the north, however, a very different picture was emerging in the form of Celtic Christianity. In the two hundred years after the Romans had departed, a significant gulf had formed between the Celtic and Roman missions, which saw Celtic monotheistic spirituality develop freely in isolation from Rome’s dominion. By the end of the sixth century, Celtic Christianity was wholly monastic in its structure, spearheaded by ascetic communities in Ireland whose efforts saw the large-scale conversion away from paganism on the island. Several aspects of the Celts’ tribal outlook were reflected in their newly-emerging religious practices, with an understanding of faith that celebrated grace and nature as gifts from God, with strong traditions of poetry, mysticism, and inclusion of women in its leadership.	true
building_description_texts_long_description_vik_granary_long	Archaeological evidence indicates that the main catalyst for the human transition from hunter-gatherer to farmer was the cultivation of wheat and grain. A useful food source both directly and as an animal feed, grain was highly important to sedentary societies for thousands of years, dating back to Neolithic times. Its obvious advantage was the ability to harvest a surplus, which gave rise to the need for granaries. In Britain, the Roman villa system meant that a vast amount of farming was taking place before the era of Saxon dominance, and subsequent settlers on the Isles continued using the old Roman techniques of grain storage. Granaries had raised floors to allow air to circulate, keeping the yield dry and mould-free, as well as protecting it against ground-based pests. The bulkiness of surpluses also meant that granary walls had to be thick enough to resist great weight, while extra-wide eaves ensured that walls also stayed absolutely dry.	true
building_description_texts_long_description_vik_garrison_long	Not all warriors fight on the front line, at the literal bleeding edge of war. In a world before professional, large-scale armies, garrisons were used as a method of cultural conversion, and then as a defensive redoubt. The Romans called their process of garrisoning 'colonia', which involved settling citizens in conquered towns to Romanise the population. This occurred in Britain before the dominance of the Saxons, who later used a ‘fyrd’ system of mobilised armies made up of self-equipped freemen. For many groups of that era, in the most desperate times of war every able-bodied man would have been encouraged to fight, but where men could be spared a garrison would have been left behind to help protect the populace and their commodities. In the worst of times, however, when kingdoms suffered significant losses, garrisons were reserved for the most valuable of settlements. After all, kingdoms could be rebuilt, but a warrior could only die once.	true
building_description_texts_long_description_vik_assembly_long	In the early medieval world, the governance of the populace was aided by areas where large congregations of people could be addressed directly by their leaders. As the kings of post-Roman Britain saw the number of people under their rule increase, they needed more effective ways to consolidate their power over them. Appearing before their subjects in person and speaking to them face-to-face was one such method, and the use of outdoor assembly areas made it possible in practice. The king still had to get to such places, however, travelling with his retinue to settlements with such facilities, where his subjects in the area would congregate before him. Archaeological evidence in Northumbria indicates that outdoor assemblies and grandstands were, in effect, like the parliament buildings of the early Middle Ages, where it was likely some back-and-forth would have occurred between the king and his subjects. They were probably cuneiform in shape, triangular buildings with sitting-steps focused on an area bordered by a screen at the back and sides to aid voice amplification. Since they were places of royal use, they were contained within protected hill-forts or fortified parts of settlements.	true
building_description_texts_long_description_vik_library_long	Even prior to King Alfred’s education reforms that he was so well-known for, historical records point to an earlier era of scholarship in England and Ireland coinciding with the region’s conversion to Christianity. In the time of Bede, the ‘Father of English History’, the libraries of the Dark Ages were exclusively places of ecclesiastical learning, used and run by monks in monasteries. Bede himself was an author, scholar, and priest, whose works imply that he had access to a great many books of contemporary and classical authors of his day. Indeed, it is known that Bede’s very own monastery had an impressive library of imported works. Most of the books found there would have been written in Latin, and his work alludes to a familiarity with Christian poets, classical historians and authors, Latin grammarians, and even some works in Greek, probably of theological origin.	true
building_description_texts_long_description_vik_workshop_long	As Britannia settled into a period of uneasy peace following the Vikings’ settlement of the Danelaw during the 9th century, the work of British craftsmen began to gain popularity both abroad and at home. As a result of increases in demand, particularly from Church building projects which required highly-skilled, ornate workmanship delivered to tight deadlines, small ‘cottage’ industries gave way to workshops where production could be better organised to meet the cost and time constraints of the project in hand.	true
building_description_texts_long_description_vik_artisans_long	Jewellery was always very important to the Anglo-Saxons, with fine objects being crafted from precious metals such as gold, amethyst and even amber depending on the social status of the wearer. Due to the diverse nature of Isles’ population, it’s unsurprising that much of the jewellery produced around the time of the 7th and 8th centuries, particularly in Saxon and Viking England, had central and northern European influences at first. Over time, however, a unique, insular style developed here which fed back into central and southern Europe, with the work of Saxon jewellers adorning churches as far south as Rome itself. As a result of this demand, goldsmiths in particular were allowed to move freely wherever their work took them.	true
building_description_texts_long_description_vik_copper_long	Copper is the oldest known metal in the world, the use of which dates back many centuries BC. It was known to the Greeks and Romans as 'cuprum' or 'cyprium', a reference to Cyprus, one of the largest copper mines in the ancient world. It is the primary ingredient of bronze, and although the bronze age ended in roughly 1200 BC to give way to the widespread use of iron, the good rust resistance of copper alloys guaranteed the continued use of bronze in a variety of outdoor applications. It was used for things like door components, fountains, statues, horse-related apparatus, buckles, and anything else that might be exposed to moisture. Copper was also collected, traded, and used by the Vikings, especially for jewellery, with places like 9th century Viking-occupied York known to have been a location of the manufacture of many such trinkets for trade purposes.	true
building_description_texts_long_description_vik_silver_long	By the end of the 8th century, most silver used to mint coins on the British Isles was thought to have originated overseas. Local veins had been worked out from Roman times, and mining technology was beyond the experience and investment potential of the time. Eventually, however, Britain and Ireland’s small-scale silver mining industries grew to cater for the increased use of coin in commercial transactions. Shallow enriched ore deposits in Carboniferous Limestone areas were put into use, although deeper-seated deposits of higher yields would not be exploited until several centuries later. In the invading Vikings’ hands, silver was donned in various forms as high-status dress items or broken up as a form of hack-silver currency. Hoard findings dating back to the ninth century also indicate that most plundered Viking silver was likely kept until eventually melted down into more acceptable forms more useful to their bullion economy, such as ingots and rings.	true
building_description_texts_long_description_vik_estate_long	With the collapse the Roman Empire, Europe of the Middle Ages evolved the Roman villa system into three elements; the feudal system, manorialism and serfdom. In Britain, many kings of the land used a system in which they would garner favour from their nobles and their retinues by bequeathing their estates scattered throughout their realm. Estates were highly profitable for a noble or ealdorman, largely used to provide coin for things like payments to armies, or the hiring of labour to build fortifications and bridges in the surrounding area. Estate manors were also used as royal accommodation, as kings commonly moved from one estate to another when travelling and conducting royal business. It was no small matter to offer hospitality to royal company, and it was not uncommon for purveyors to inspect a royal estate for its provisions and amenities the day before a royal visit, if not only to ensure an adequate supply of mead!	true
building_description_texts_long_description_vik_market_long	By the time of Viking settlement on the British Isles, the locals were already trading in at least two important commodities on a large scale – salt and metals. The former was crucial for meat and fish preservation, while the latter was needed to make the tools and weapons with which livelihoods were made and protected respectively. In agricultural trade, most large-scale farmers produced yields of crops to fulfil an obligation to a lord or king on top of their own subsistence, but any surplus would then be sold at a grain exchange or fair. The Viking threat to the Isles also provided a motor for trade there, with centres of commerce blossoming where people had gathered to live more safely in greater numbers. In fact, several 9th century market towns prospered due to their proximity with King Alfred the Great’s 'burhs', a system of forts originally established as a network of Saxon strongholds to defend against invasion.	true
building_description_texts_long_description_vik_court_long	Although Welsh law became increasingly superseded by English law in the 13th century, Wales had a rich legal tradition dating back to a few hundred years before that. The 10th century Welsh monarch Howel Dda, also known as 'Howel the Good', was chiefly remembered for consolidating all the laws used to govern Welsh lands, which gradually fell into his dominion through his marital ties and deaths in his ruling family. He did not create the laws as such – many actually predated his lifetime – but he was believed to have adapted existing law traditions to codify into his own legal tenets, which came to be known as the 'Law of Howel'. It is thought that his epithet 'the Good' was due to the fact that his laws did not overly stress his royal power, but instead were aimed at protecting the people of Wales. Living under Howel’s laws became one of the definitions of Welsh people in the centuries to come, with the Welsh lawbooks and legal manuscripts of the era giving a fascinating insight into life in early medieval Wales.	true
building_description_texts_long_description_vik_tanner_long	People have used hides to protect and clothe themselves ever since they began to trap and kill animals. As animal husbandry developed and the availability of hides increased, tanning processes were introduced to make leathers more durable. By the Middle Ages, tanning was becoming an important trade, with archaeological evidence of Saxon-era tanneries seen in places like Winchester, where two rectangular pits were found at Lower Brook Street. The pits were lined with clay and wood, with a water channel running through the room which was wide enough to wash hides, and traces of animal hairs found around the pits assumed to be sweepings from the surrounding area. Most tellingly, these elements were all located in a house which fronted onto a road known as Tannerestret, the 'Street of the Tanners’, a name dating from the late 10th century. Today, there is a Tanner Street in many English towns and cities.	true
